target,modality,biomarker_context,indication_used_in_trial,representative_agent_or_program,status,success_summary,reference  
Copiktra,small molecule,follicular lymphoma after withdrawal,follicular lymphoma,duvelisib,failure,Withdrawal context due to confirmatory issues,FDA withdrawn approvals; negative trial  
Exkivity,small molecule,EGFR exon20 insertion after withdrawal,NSCLC,mobocertinib,failure,Withdrawn because confirmatory benefit was not established,FDA withdrawn approvals; negative trial  
Truseltiq,small molecule,FGFR2 fusion after withdrawal,cholangiocarcinoma,infigratinib,failure,Withdrawal reflects limited confirmatory support,FDA withdrawn approvals; negative trial  
Gavreto,small molecule,RET mutation or fusion after withdrawal,thyroid cancer or NSCLC,pralsetinib,failure,Regulatory status has faced indication changes,FDA withdrawn approvals; negative trial  
Tecentriq,biologic,urothelial carcinoma after withdrawal,urothelial carcinoma,atezolizumab,failure,Some urothelial indications were withdrawn after confirmatory failure,FDA withdrawn approvals; negative trial  
Imfinzi,biologic,urothelial carcinoma after withdrawal,urothelial carcinoma,durvalumab,failure,Withdrawal context in urothelial indications,FDA withdrawn approvals; negative trial  
Keytruda,biologic,SCLC after withdrawal,small-cell lung cancer,pembrolizumab,failure,Accelerated approval pathway required confirmatory support,FDA withdrawn approvals; negative trial  
Opdivo,biologic,HCC after withdrawal,hepatocellular carcinoma,nivolumab,failure,Regulatory history includes withdrawn indication context,FDA withdrawn approvals; negative trial  
Lartruvo,biologic,PDGFR-alpha positive soft tissue sarcoma,soft tissue sarcoma,olaratumab,failure,Confirmatory failure ended clinical use,FDA withdrawn approvals; negative trial  
Avastin,biologic,HER2-negative breast cancer,metastatic breast cancer,bevacizumab,failure,Historical indication withdrawal in breast cancer,FDA withdrawn approvals; negative trial  
CD47,biologic,AML and solid tumors,AML,magrolimab,failure,Program did not achieve durable late-stage success,Negative trial; review  
CD47,biologic,solid tumors,solid tumors,Hu5F9-G4,failure,Clinical development has been limited by mixed outcomes,Negative trial; review  
ALK,small molecule,ALK-negative NSCLC,NSCLC,ALK inhibitors,failure,Biomarker mismatch leads to lack of benefit,Negative trial; review  
RET,small molecule,RET-negative NSCLC,NSCLC,RET inhibitors,failure,No target no benefit in negative biomarker setting,Negative trial; review  
NTRK,small molecule,NTRK-negative tumors,unselected solid tumors,NTRK inhibitors,failure,Target absence predicts lack of activity,Negative trial; review  
ERBB2,biologic,HER2-negative breast cancer,breast cancer,HER2 antibody therapy,failure,Lack of HER2 biomarker undermines efficacy,Negative trial; review  
PARP,small molecule,BRCA-wildtype ovarian cancer,ovarian cancer,PARP inhibitors,failure,Benefit is much weaker outside HRD contexts,Negative trial; review  
CDK4/6,small molecule,RB-loss breast cancer,breast cancer,CDK4/6 inhibitors,failure,RB loss is a known resistance setting,Negative trial; review  
FLT3,small molecule,FLT3-wildtype AML,AML,FLT3 inhibitors,failure,Target absence predicts lack of benefit,Negative trial; review  
BRAF,small molecule,BRAF-wildtype melanoma,melanoma,BRAF inhibitors,failure,No driver mutation no targetable benefit,Negative trial; review  
PD-1,biologic,MSS colorectal cancer,metastatic colorectal cancer,PD-1 monotherapy,failure,Checkpoint monotherapy remains ineffective in this setting,Negative trial; review  
EGFR,small molecule,KRAS-mutant colorectal cancer,colorectal cancer,EGFR inhibitors,failure,KRAS mutation predicts non-response,Negative trial; review  
PI3K,small molecule,unselected breast cancer,breast cancer,PI3K inhibitors,failure,Unselected populations dilute biomarker-linked benefit,Negative trial; review  
Metformin,small molecule,advanced solid tumors,solid tumors,metformin repurposing,failure,Repurposing effort has not shown robust oncology efficacy,Negative trial; review  
IDH1,small molecule,IDH-wildtype tumors,solid tumors,IDH1 inhibitors,failure,No biomarker no meaningful target engagement,Negative trial; review  
BCMA,cell therapy,BCMA-low myeloma,multiple myeloma,BCMA CAR-T,failure,Low antigen density can undermine response,Negative trial; review  
CLDN18.2,biologic,CLDN18.2-negative gastric cancer,gastric cancer,CLDN18.2 antibodies,failure,Target absence predicts lack of efficacy,Negative trial; review  
PSMA,radioligand,PSMA-low prostate cancer,prostate cancer,PSMA radioligand therapy,failure,Low target expression limits activity,Negative trial; review  
SSTR2,radioligand / peptide,SSTR2-negative tumors,non-NET solid tumors,SSTR2-directed therapy,failure,Target absence prevents clinical usefulness,Negative trial; review  
CD19,cell therapy,T-cell leukemia,T-cell leukemia,CD19 CAR-T,failure,Lineage mismatch limits target validity,Negative trial; review  
CD22,ADC / cell therapy,CD22-negative ALL,ALL,CD22-directed therapy,failure,Target-negative disease is not responsive,Negative trial; review  
TROP2,ADC,TROP2-low lung cancer,NSCLC,TROP2 ADCs,failure,Low antigen density can limit ADC benefit,Negative trial; review  
EGFR,small molecule,post-withdrawal exon20 program,NSCLC,mobocertinib,failure,Withdrawal reflects limited confirmatory success,FDA withdrawn approvals; negative trial  
MET,small molecule,MET-negative NSCLC,NSCLC,MET inhibitors,failure,Without MET alteration benefit is limited,Negative trial; review  
HSP90,small molecule,refractory solid tumors,solid tumors,ganetespib,failure,Classical example of limited durable efficacy,Negative trial; review  
